[
  {
    "child_entity_id": "auditorium-teatro-grande",
    "child_entity_type": "BUILDING",
    "link_id": "cinema-unical__has_child_building__auditorium-teatro-grande",
    "parent_entity_id": "cinema-unical",
    "parent_entity_type": "PLACE",
    "relation_type": "HAS_CHILD_BUILDING",
    "sort_order": 10,
    "source_id": "unical-services",
    "source_url": "https://www.unical.it/campus/vivere-il-campus/teatri-e-cinema/cinema-e-anfiteatri/"
  },
  {
    "child_entity_id": "auditorium-teatro-grande",
    "child_entity_type": "BUILDING",
    "link_id": "polo-infanzia__has_child_building__auditorium-teatro-grande",
    "parent_entity_id": "polo-infanzia",
    "parent_entity_type": "PLACE",
    "relation_type": "HAS_CHILD_BUILDING",
    "sort_order": 10,
    "source_id": "unical-services",
    "source_url": "https://www.unical.it/campus/vivere-il-campus/polo-infanzia/"
  },
  {
    "child_entity_id": "maisonnettes",
    "child_entity_type": "BUILDING",
    "link_id": "quartiere-maisonnettes__has_child_building__maisonnettes",
    "parent_entity_id": "quartiere-maisonnettes",
    "parent_entity_type": "PLACE",
    "relation_type": "HAS_CHILD_BUILDING",
    "sort_order": 10,
    "source_id": "unical-campus-map",
    "source_url": "https://www.unical.it/campus/visita-il-campus/mappa/"
  },
  {
    "child_entity_id": "biblioteca-bats",
    "child_entity_type": "PLACE",
    "link_id": "service-biblioteche__has_child_place__biblioteca-bats",
    "parent_entity_id": "service-biblioteche",
    "parent_entity_type": "PLACE",
    "relation_type": "HAS_CHILD_PLACE",
    "sort_order": 30,
    "source_id": "unical-services",
    "source_url": "https://www.unical.it/campus/vivere-il-campus/biblioteche/"
  },
  {
    "child_entity_id": "biblioteca-bau",
    "child_entity_type": "PLACE",
    "link_id": "service-biblioteche__has_child_place__biblioteca-bau",
    "parent_entity_id": "service-biblioteche",
    "parent_entity_type": "PLACE",
    "relation_type": "HAS_CHILD_PLACE",
    "sort_order": 10,
    "source_id": "unical-services",
    "source_url": "https://www.unical.it/campus/vivere-il-campus/biblioteche/"
  },
  {
    "child_entity_id": "biblioteca-tarantelli",
    "child_entity_type": "PLACE",
    "link_id": "service-biblioteche__has_child_place__biblioteca-tarantelli",
    "parent_entity_id": "service-biblioteche",
    "parent_entity_type": "PLACE",
    "relation_type": "HAS_CHILD_PLACE",
    "sort_order": 20,
    "source_id": "unical-services",
    "source_url": "https://www.unical.it/campus/vivere-il-campus/biblioteche/"
  },
  {
    "child_entity_id": "aula-magna-centro-congressi",
    "child_entity_type": "PLACE",
    "link_id": "service-centro-congressi__has_child_place__aula-magna-centro-congressi",
    "parent_entity_id": "service-centro-congressi",
    "parent_entity_type": "PLACE",
    "relation_type": "HAS_CHILD_PLACE",
    "sort_order": 10,
    "source_id": "unical-services",
    "source_url": "https://www.unical.it/campus/vivere-il-campus/centro-congressi/"
  },
  {
    "child_entity_id": "aula-u-caldora-centro-congressi",
    "child_entity_type": "PLACE",
    "link_id": "service-centro-congressi__has_child_place__aula-u-caldora-centro-congressi",
    "parent_entity_id": "service-centro-congressi",
    "parent_entity_type": "PLACE",
    "relation_type": "HAS_CHILD_PLACE",
    "sort_order": 30,
    "source_id": "unical-services",
    "source_url": "https://www.unical.it/campus/vivere-il-campus/centro-congressi/"
  },
  {
    "child_entity_id": "sala-a-centro-congressi",
    "child_entity_type": "PLACE",
    "link_id": "service-centro-congressi__has_child_place__sala-a-centro-congressi",
    "parent_entity_id": "service-centro-congressi",
    "parent_entity_type": "PLACE",
    "relation_type": "HAS_CHILD_PLACE",
    "sort_order": 60,
    "source_id": "unical-services",
    "source_url": "https://www.unical.it/campus/vivere-il-campus/centro-congressi/"
  },
  {
    "child_entity_id": "sala-mostre-centro-congressi",
    "child_entity_type": "PLACE",
    "link_id": "service-centro-congressi__has_child_place__sala-mostre-centro-congressi",
    "parent_entity_id": "service-centro-congressi",
    "parent_entity_type": "PLACE",
    "relation_type": "HAS_CHILD_PLACE",
    "sort_order": 20,
    "source_id": "unical-services",
    "source_url": "https://www.unical.it/campus/vivere-il-campus/centro-congressi/"
  },
  {
    "child_entity_id": "sala-stampa-centro-congressi",
    "child_entity_type": "PLACE",
    "link_id": "service-centro-congressi__has_child_place__sala-stampa-centro-congressi",
    "parent_entity_id": "service-centro-congressi",
    "parent_entity_type": "PLACE",
    "relation_type": "HAS_CHILD_PLACE",
    "sort_order": 50,
    "source_id": "unical-services",
    "source_url": "https://www.unical.it/campus/vivere-il-campus/centro-congressi/"
  },
  {
    "child_entity_id": "university-club",
    "child_entity_type": "PLACE",
    "link_id": "service-centro-congressi__has_child_place__university-club",
    "parent_entity_id": "service-centro-congressi",
    "parent_entity_type": "PLACE",
    "relation_type": "HAS_CHILD_PLACE",
    "sort_order": 40,
    "source_id": "unical-services",
    "source_url": "https://www.unical.it/campus/vivere-il-campus/centro-congressi/"
  },
  {
    "child_entity_id": "service-mineralogia-e-petrografia",
    "child_entity_type": "PLACE",
    "link_id": "service-musnob__has_child_place__service-mineralogia-e-petrografia",
    "parent_entity_id": "service-musnob",
    "parent_entity_type": "PLACE",
    "relation_type": "HAS_CHILD_PLACE",
    "sort_order": 40,
    "source_id": "unical-services",
    "source_url": "https://www.unical.it/campus/vivere-il-campus/sistema-museale/musnob/"
  },
  {
    "child_entity_id": "service-orto-botanico",
    "child_entity_type": "PLACE",
    "link_id": "service-musnob__has_child_place__service-orto-botanico",
    "parent_entity_id": "service-musnob",
    "parent_entity_type": "PLACE",
    "relation_type": "HAS_CHILD_PLACE",
    "sort_order": 10,
    "source_id": "unical-services",
    "source_url": "https://www.unical.it/campus/vivere-il-campus/sistema-museale/musnob/"
  },
  {
    "child_entity_id": "service-paleontologia",
    "child_entity_type": "PLACE",
    "link_id": "service-musnob__has_child_place__service-paleontologia",
    "parent_entity_id": "service-musnob",
    "parent_entity_type": "PLACE",
    "relation_type": "HAS_CHILD_PLACE",
    "sort_order": 20,
    "source_id": "unical-services",
    "source_url": "https://www.unical.it/campus/vivere-il-campus/sistema-museale/musnob/"
  },
  {
    "child_entity_id": "service-zoologia",
    "child_entity_type": "PLACE",
    "link_id": "service-musnob__has_child_place__service-zoologia",
    "parent_entity_id": "service-musnob",
    "parent_entity_type": "PLACE",
    "relation_type": "HAS_CHILD_PLACE",
    "sort_order": 30,
    "source_id": "unical-services",
    "source_url": "https://www.unical.it/campus/vivere-il-campus/sistema-museale/musnob/"
  },
  {
    "child_entity_id": "polo-infanzia",
    "child_entity_type": "PLACE",
    "link_id": "service-polo-infanzia__has_child_place__polo-infanzia",
    "parent_entity_id": "service-polo-infanzia",
    "parent_entity_type": "PLACE",
    "relation_type": "HAS_CHILD_PLACE",
    "sort_order": 10,
    "source_id": "unical-services",
    "source_url": "https://www.unical.it/campus/vivere-il-campus/polo-infanzia/"
  },
  {
    "child_entity_id": "quartiere-chiodo",
    "child_entity_type": "PLACE",
    "link_id": "service-quartieri__has_child_place__quartiere-chiodo",
    "parent_entity_id": "service-quartieri",
    "parent_entity_type": "PLACE",
    "relation_type": "HAS_CHILD_PLACE",
    "sort_order": 10,
    "source_id": "unical-services",
    "source_url": "https://www.unical.it/campus/vivere-il-campus/quartieri/"
  },
  {
    "child_entity_id": "quartiere-chiodo-2",
    "child_entity_type": "PLACE",
    "link_id": "service-quartieri__has_child_place__quartiere-chiodo-2",
    "parent_entity_id": "service-quartieri",
    "parent_entity_type": "PLACE",
    "relation_type": "HAS_CHILD_PLACE",
    "sort_order": 20,
    "source_id": "unical-services",
    "source_url": "https://www.unical.it/campus/vivere-il-campus/quartieri/"
  },
  {
    "child_entity_id": "quartiere-maisonnettes",
    "child_entity_type": "PLACE",
    "link_id": "service-quartieri__has_child_place__quartiere-maisonnettes",
    "parent_entity_id": "service-quartieri",
    "parent_entity_type": "PLACE",
    "relation_type": "HAS_CHILD_PLACE",
    "sort_order": 30,
    "source_id": "unical-services",
    "source_url": "https://www.unical.it/campus/vivere-il-campus/quartieri/"
  },
  {
    "child_entity_id": "quartiere-martensson-a",
    "child_entity_type": "PLACE",
    "link_id": "service-quartieri__has_child_place__quartiere-martensson-a",
    "parent_entity_id": "service-quartieri",
    "parent_entity_type": "PLACE",
    "relation_type": "HAS_CHILD_PLACE",
    "sort_order": 40,
    "source_id": "unical-services",
    "source_url": "https://www.unical.it/campus/vivere-il-campus/quartieri/"
  },
  {
    "child_entity_id": "quartiere-martensson-b",
    "child_entity_type": "PLACE",
    "link_id": "service-quartieri__has_child_place__quartiere-martensson-b",
    "parent_entity_id": "service-quartieri",
    "parent_entity_type": "PLACE",
    "relation_type": "HAS_CHILD_PLACE",
    "sort_order": 50,
    "source_id": "unical-services",
    "source_url": "https://www.unical.it/campus/vivere-il-campus/quartieri/"
  },
  {
    "child_entity_id": "quartiere-mira",
    "child_entity_type": "PLACE",
    "link_id": "service-quartieri__has_child_place__quartiere-mira",
    "parent_entity_id": "service-quartieri",
    "parent_entity_type": "PLACE",
    "relation_type": "HAS_CHILD_PLACE",
    "sort_order": 60,
    "source_id": "unical-services",
    "source_url": "https://www.unical.it/campus/vivere-il-campus/quartieri/"
  },
  {
    "child_entity_id": "quartiere-molicelle",